{"schema_version":"unirouter.integration-control.n1-pin.v1","neutral_release_schema_version":"foigent.integration-control.release.v1","source_commit":"12f1ede8ae85e9d311a8150694eea54ff6f02950","source_tree":"e6945fa071afd6a0b9317d3ec862cbcbf47a0154","release_commit":"c9e5a77dd0416654d8e46efb09f18a6ecca026f8","release_tree":"325863188f625c07e9f10a7a3eae67f9574de198","release_manifest_sha256":"sha256:0604100b8cb8c8a728fc091d1c9269eafbc3cb70449222ab6c10657bca33d3e5","contracts_sha256":"sha256:a3697170a39aa97f81d690e2532b19383d1f77eb7b59c3273e37a3f04b24e186","valid_fixtures_sha256":"sha256:a5df1bc8c42f01d71f41c2dd6706994549920573a448d95e699fff9d39b2fa46","invalid_fixtures_sha256":"sha256:850df4fb845acc40770cb98fd6d6c9638599dba30955e3efd4b899dbc9fcfad8","capability_boundary":"offline_files_only","artifacts":[{"os":"darwin","architecture":"arm64","size_bytes":4034066,"sha256":"sha256:ba574ac25abd063914d785a34d097b14a1cf09021a953c40803414900c1f3dc1"},{"os":"linux","architecture":"amd64","size_bytes":4132939,"sha256":"sha256:b37a9b92ef237844327911b9a4b1a1266b2970f3acbc50de428aa7d518a1fbb8"}]}